Task,Module,Priority,Status,Notes
Add clinic_id filtering to patient routes,Multi-Clinic,High,Pending,Filter data by user's clinic
Add clinic_id filtering to appointment routes,Multi-Clinic,High,Pending,Filter data by user's clinic
Add clinic_id filtering to DICOM routes,Multi-Clinic,High,Pending,Filter data by user's clinic
Add clinic_id filtering to report routes,Multi-Clinic,High,Pending,Filter data by user's clinic
Add clinic_id when creating new records,Multi-Clinic,High,Pending,Auto-assign clinic_id from current user
Run database migration for clinics,Multi-Clinic,High,Pending,flask db upgrade
Create default clinic and assign existing data,Multi-Clinic,High,Pending,Part of migration
Test all Super Admin APIs,Testing,Medium,Pending,
Test multi-clinic data isolation,Testing,High,Pending,Ensure clinics don't see each other's data
Frontend development,Frontend,High,Pending,Not started
Mobile app development,Mobile,Low,Pending,Future scope
Unit tests,Testing,Medium,Pending,
API documentation (Swagger),Docs,Low,Pending,
